{
  "id": "5b6c7d8e-9f0a-4b1c-8d2e-3f4a5b6c7d8e",
  "goal": "Построить карту по статье из Telegram",
  "inputs": {
    "file": "tg-file-123"
  },
  "status": "succeeded",
  "origin": {
    "type": "run",
    "id": "3f2b8c1e-5d4a-4e6f-9a7b-1c2d3e4f5a6b"
  },
  "run_id": "8e9f0a1b-2c3d-4e5f-8a6b-7c8d9e0f1a2b",
  "budget": {
    "max_steps": 20,
    "max_duration_seconds": 1800,
    "max_cost_usd": 0.5
  },
  "delivery": {
    "channels": [
      "push",
      "inbox"
    ]
  },
  "attempt": 1,
  "created_at": "2026-10-09T10:01:00Z",
  "started_at": "2026-10-09T10:01:01Z",
  "finished_at": "2026-10-09T10:04:30Z",
  "result": {
    "speech": "Карта по статье готова.",
    "display": {
      "kind": "app",
      "plugin_id": "team.mindweaver",
      "resource_uri": "ui://team.mindweaver/map"
    },
    "followups": []
  },
  "error": null
}
